{
  "$schema": "http://json-schema.org/draft-07/schema#",
  "title": "당근마켓 알림 감시 목록",
  "type": "object",
  "properties": {
    "defaultEmail": {
      "description": "watch 에 email 이 없을 때 사용할 기본 수신 이메일. 여러 명은 배열 또는 쉼표구분 문자열.",
      "oneOf": [
        { "type": "string" },
        { "type": "array", "items": { "type": "string", "format": "email" } }
      ]
    },
    "defaultChatMessage": {
      "type": "string",
      "description": "watch 에 chatMessage 가 없을 때 사용할 기본 채팅 인사말"
    },
    "sendEmail": {
      "type": "boolean",
      "description": "신규 매물 발견 시 이메일 발송 여부 (기본 true)",
      "default": true
    },
    "createIssues": {
      "type": "boolean",
      "description": "신규 매물 발견 시 GitHub 이슈 등록 여부 (기본 true)",
      "default": true
    },
    "watches": {
      "type": "array",
      "items": {
        "type": "object",
        "required": ["keyword"],
        "properties": {
          "id": {
            "type": "string",
            "description": "감시 항목 고유 ID (상태 추적용). 없으면 자동 생성"
          },
          "keyword": {
            "type": "string",
            "description": "조회할 제품 키워드 (제목에 포함되면 매칭). 예: 가마솥. maxPrice가 0일 때 나눔/무료나눔/무료를 쓰면 제품명과 관계없이 모든 무료 매물을 매칭."
          },
          "location": {
            "type": "string",
            "description": "구매 가능 지역 (매물 지역/제목에 포함되면 매칭). 예: 수원시"
          },
          "daangnRegion": {
            "type": "string",
            "description": "당근 검색 URL의 in 파라미터 값. 예: 매탄동-4535"
          },
          "sites": {
            "type": "array",
            "description": "검색할 사이트 키 목록. 미지정이면 전체(당근+중고나라+번개장터).",
            "items": { "type": "string", "enum": ["daangn", "joongna", "bunjang"] }
          },
          "maxPrice": {
            "type": "number",
            "description": "희망 금액(원). 양수는 해당 금액 '이하', 0은 무료 매물(당근 나눔, 중고나라·번개장터 0원)만 알림. 미지정이면 금액 제한 없음.",
            "minimum": 0
          },
          "email": {
            "description": "알림 수신 이메일. 없으면 defaultEmail 사용. 여러 명은 배열 또는 쉼표구분 문자열.",
            "oneOf": [
              { "type": "string" },
              { "type": "array", "items": { "type": "string", "format": "email" } }
            ]
          },
          "chatMessage": {
            "type": "string",
            "description": "채팅 도우미에 미리 채워질 인사말. 없으면 defaultChatMessage 사용"
          },
          "enabled": {
            "type": "boolean",
            "description": "false 면 이 항목을 검사하지 않음",
            "default": true
          }
        }
      }
    }
  },
  "required": ["watches"]
}
