{
  "$schema": "./watches.schema.json",
  "defaultEmail": "leemgs@gmail.com",
  "defaultChatMessage": "안녕하세요. 제가 구매 가능할까요?",
  "sendEmail": true,
  "createIssues": true,
  "watches": [
    {
      "id": "롱샴-경기도",
      "keyword": "롱샴",
      "location": "경기도",
      "maxPrice": 40000,
      "email": "leemgs@gmail.com",
      "chatMessage": "안녕하세요. 제가 구매 가능할까요?",
      "enabled": false
    },
    {
      "id": "고추대-수원시영통구",
      "keyword": "고추대",
      "location": "수원시영통구",
      "email": "leemgs@gmail.com",
      "enabled": false
    },
    {
      "id": "맥북-에어-m5-경기도",
      "keyword": "맥북 에어 M5",
      "location": "경기도",
      "maxPrice": 1600000,
      "email": [
        "leemgs@gmail.com",
        "khs7516@gmail.com",
        "lsy0314@gmail.com"
      ],
      "enabled": false
    },
    {
      "id": "노트20-uag-수원시",
      "keyword": "노트20 UAG",
      "location": "수원시",
      "maxPrice": 20000,
      "maxAgeDays": 1,
      "email": "leemgs@gmail.com",
      "enabled": false
    },
    {
      "id": "lpg캠핑-수원시영통구",
      "keyword": "LPG캠핑",
      "location": "수원시영통구",
      "sites": [
        "daangn"
      ],
      "maxPrice": 50000,
      "email": "leemgs@gmail.com",
      "enabled": false
    },
    {
      "id": "s24-수원시영통구",
      "keyword": "S24+",
      "location": "수원시영통구",
      "enabled": false
    },
    {
      "id": "투명아크릴판-화성시",
      "keyword": "투명아크릴판",
      "location": "화성시",
      "sites": [
        "daangn"
      ],
      "maxPrice": 41000,
      "maxAgeDays": 1,
      "email": "leemgs@gmail.com",
      "enabled": false
    },
    {
      "id": "화강암-수원시",
      "keyword": "화강암",
      "location": "수원시",
      "sites": [
        "daangn"
      ],
      "maxPrice": 0,
      "maxAgeDays": 1,
      "email": "leemgs@gmail.com",
      "enabled": false
    },
    {
      "id": "s24-수원시",
      "keyword": "S24+",
      "location": "수원시",
      "sites": [
        "daangn"
      ],
      "maxPrice": 350000,
      "maxAgeDays": 1,
      "email": "leemgs@gmail.com",
      "enabled": false
    },
    {
      "id": "건조대-수원시",
      "keyword": "건조대",
      "location": "수원시",
      "sites": [
        "daangn"
      ],
      "maxPrice": 0,
      "maxAgeDays": 1,
      "email": "leemgs@gmail.com",
      "enabled": false
    },
    {
      "id": "장독-김천시",
      "keyword": "장독",
      "location": "김천시",
      "sites": [
        "daangn"
      ],
      "maxPrice": 50000,
      "maxAgeDays": 1,
      "email": "leemgs@gmail.com",
      "enabled": true
    },
    {
      "id": "낚시대-수원시",
      "keyword": "낚시대",
      "location": "수원시",
      "sites": [
        "daangn"
      ],
      "maxPrice": 30000,
      "maxAgeDays": 1,
      "email": "leemgs@gmail.com",
      "enabled": false
    },
    {
      "id": "메탈선반-수원시",
      "keyword": "메탈선반",
      "location": "수원시",
      "sites": [
        "daangn"
      ],
      "maxPrice": 10000,
      "maxAgeDays": 1,
      "email": "leemgs@gmail.com",
      "enabled": false
    },
    {
      "id": "욕실매트-수원시",
      "keyword": "욕실매트",
      "location": "수원시",
      "sites": [
        "daangn"
      ],
      "maxAgeDays": 1,
      "email": "leemgs@gmail.com",
      "enabled": true
    }
  ]
}
